DOI	Title	Authors	Abstract	Journal	Date
10.1111/jcmm.70434	machine learning base glycolipid metabolism gene signature predict prognosis	Zhu L, Liang F, Han X, Ye B, Xue L	use machine learning approach develop validate novel prognostic model oesophageal squamous cell carcinoma escc base glycolipid metabolism relate gene . integrated analysis tcga geo dataset establish robust 15 gene signature effectively stratify patient distinct risk group . signature demonstrate superior prognostic value reveal significant association immune infiltration pattern . high risk patient exhibit reduce immune cell infiltration particularly b cell nk cell alongside increase tumour purity . single cell rna sequence analysis uncover unique cellular composition pattern enhance interaction intensity high risk group especially epithelial smooth muscle cell . functional validation confirm mecp2 promising therapeutic target knockdown significantly inhibit tumour progression   vitro   vivo . drug sensitivity analysis identify specific therapeutic agent show potential efficacy high risk patient . study provide practical prognostic tool novel insight relationship glycolipid metabolism tumour immunity escc offer potential strategy personalise treatment .	Journal of cellular and molecular medicine	01/03/2025
10.1038/s41591-025-03570-5	optimal dietary pattern healthy aging .	Tessier AJ, Wang F, Korat AA, Eliassen AH, Chavarro J, Grodstein F, Li J, Liang L, Willett WC, Sun Q, Stampfer MJ, Hu FB, Guasch-Ferré M	global population age be critical to identify diet prevent noncommunicable disease optimally promote healthy aging . here use longitudinal questionnaire datum nurses&#x27 health study 1986 2016 health professionals follow study 1986 2016 examine association long term adherence eight dietary pattern ultraprocesse food consumption healthy aging as assess accord measure cognitive physical mental health as well live 70 year age free chronic disease . to 30 year follow up 9,771 9.3 105,015 participant 66 woman mean age   =   53 year s.d .   =   8) achieve healthy aging . dietary pattern high adherence be associate great odd healthy aging domain . odd ratio highest quintile versus low range 1.45 95 confidence interval ci   =   1.35 1.57 healthful plant base diet 1.86 95 ci   =   1.71 2.01 alternative healthy eating index . when age threshold healthy aging be shift 75 year alternative healthy eating index diet show strong association healthy aging odd ratio 2.24 95 ci   =   2.01 2.50 . high intake fruit vegetable whole grain unsaturated fat nut legume low fat dairy product be link great odd healthy aging whereas high intake trans fat sodium sugary beverage red processed meat be inversely associate . finding suggest that dietary pattern rich plant base food moderate inclusion healthy animal base food may enhance overall healthy aging guide future dietary guideline .	Nature medicine	24/03/2025
10.1016/j.kint.2025.01.011	podocyte aging diabetic kidney disease .	Li L, Liu Y	podocyte injury cause series cellular change include hypertrophy dedifferentiation senescence apoptosis detachment . although evidence suggest pivotal role podocyte senescence diabetic kidney disease exact trigger underlying mechanism remain elusive . study li et   al . uncover gpr124 g protein couple receptor protect podocyte senescence inhibit focal adhesion kinase . finding underscore that gpr124 focal adhesion kinase axis could be novel target diabetic kidney disease therapy .	Kidney international	01/04/2025
10.1038/s42255-025-01234-9	vestibular neuron link motion sickness behavioural thermoregulation	Tu L, Fang X, Yang Y, Yu M, Liu H, Liu H, Yin N, Bean JC, Conde KM, Wang M, Li Y, Ginnard OZ, Liu Q, Shi Y, Han J, Zhu Y, Fukuda M, Tong Q, Arenkiel B, Xue M, He Y, Wang C, Xu Y	motion sickness be associate thermoregulation metabolic control underlying neural circuitry remain largely unknown . here show that neuron medial vestibular nuclei parvocellular part mvepc mediate hypothermic response induce motion . reactivation motion sensitive mvepc neuron recapitulates motion sickness mouse . show that motion activate neuron mvepc be glutamatergic mvepc(glu optogenetic stimulation mvepc(glu neuron mimic motion induce hypothermia signal lateral parabrachial nucleus lpbn . acute inhibition mvepc lpbn circuitry abrogate motion induce hypothermia . finally show that chronic inhibition mvepc(glu neuron prevent diet induce obesity improve glucose homeostasis suppress food intake . overall finding highlight mvepc(glu neuron potential target motion sickness treatment obesity control .	Nature metabolism	21/03/2025
10.1186/s12933-025-02688-7	explore impact metabolic comorbiditie epicardial adipose tissue	Menghoum N, Badii MC, Leroy M, Parra M, Roy C, Lejeune S, Vancraeynest D, Pasquet A, Brito D, Casadei B, Depoix C, Filippatos G, Gruson D, Edelmann F, Ferreira VM, Lhommel R, Mahmod M, Neubauer S, Persu A, Piechnik S, Hellenkamp K, Ikonomidis I, Krakowiak B, Pieske B, Pieske-Kraigher E, Pinto F, Ponikowski P, Senni M, Trochu JN, Van Overstraeten N, Wachter R, Gerber BL, Balligand JL, Beauloye C, Pouleur AC	background heart failure hf preserve ejection fraction hfpef be increasingly prevalent worldwide aging comorbiditie . epicardial adipose tissue eat favor diabete obesity be show to contribute hfpef pathophysiology be emerge therapeutic target . study explore relationship ventricular eat measure cardiovascular magnetic resonance cmr metabolic factor image characteristic control pre hf patient hfpef patient . method patient belgian cohort enrol december 2015 june 2017 be categorize hf stage pre hf n   =   16 hfpef n   =   104 compare match control n   =   26 to pre hf n   =   191 beta3 lvh cohort . biventricular eat volume be measure end diastolic short axis cine stack . belgian cohort association eat hf stage various biological imaging marker be explore . clinical endpoint be composite mortality first hf hospitalization hfpef group . result eat significantly differ group high value hfpef patient compare pre hf control 72.4   ±   20.8ml m(2)vs . 55.0   ±   11.8ml m(2 48   ±   8.9ml m(2 p   lt   0.001 belgian cohort to pre hf 52.0   ±   15.0 ml m(2 p   lt   0.001 beta3 lvh cohort . subsequent analysis focus belgian cohort . contrast atrial fibrillation diabete prevalence body mass index bmi do not differ pre hf hfpef patient . multivariable logistic regression random forest classification identify eat n terminal pro b type natriuretic peptide nt probnp h(2)fpef score strong marker hfpef status . eat be significantly correlate h(2)fpef score r   =   0.41 p   =   0.003 bmi r   =   0.30 p   lt   0.001 high sensitive troponin t r   =   0.41 p   lt   0.001 nt probnp r   =   0.37 p   lt   0.001 soluble suppression tumorigenicity-2 sst2 r   =   0.30 p   lt   0.001 e e&#x27 ratio r   =   0.33 p   lt   0.001 leave ventricular global longitudinal strain r   =   0.35 p   lt   0.001 . hfpef patient diabetes ischemic cardiomyopathy elevated sst2 be independently associate elevated eat . contrast diabete bmi increase eat be not associate prognosis . conclusion eat assess cmr be significantly high hfpef patient compare control pre hf patient irrespective diabete bmi . eat be moderately associate hfpef status . hfpef patient elevated eat exhibit marked diabetic ischemic inflammatory profile highlight potential role drug target eat . trial registration characterization heart failure preserved ejection fraction assessment efficacy mirabegron new beta3 adrenergic receptor prevention heart failure beta3_lvh . trial registration number clinicaltrials.gov . identifier nct03197350 nct02599480 .	Cardiovascular diabetology	22/03/2025
10.1038/s41467-025-58074-0	smoking aggravate neovascular age relate macular degeneration	He K, Dong X, Yang T, Li Z, Liu Y, He J, Wu M, Wei-Zhang S, Kaysar P, Cui B, Yao X, Zhang L, Zhou W, Xu H, Wei J, Liu Q, Hu J, Wang X, Yan H	age relate macular degeneration amd be prevalent neuroinflammation condition lead cause irreversible blindness elderly population . smoke significantly increase amd risk mechanism remain unclear . here investigate role sema4d plexinb1 axis progression amd sema4d plexinb1 be highly activate smoking . use patient derive sample mouse model discover that smoking increase presence sema4d surface cd8(+ t cell migrate choroidal neovascularization cnv lesion cxcl12 cxcr4 axis interact receptor plexinb1 choroidal pericyte . lead ror2 mediate plexinb1 phosphorylation pericyte activation thereby disrupt vascular homeostasis promote neovascularization . inhibition sema4d reduce cnv improve benefit anti vegf treatment . conclusion study unveil molecular mechanism smoking exacerbate amd pathology present potential therapeutic strategy target sema4d to augment current amd treatment .	Nature communications	22/03/2025
10.1038/s41419-025-07498-z	histone lactylation enhance gclc expression thus promote chemoresistance	Deng J, Li Y, Yin L, Liu S, Li Y, Liao W, Mu L, Luo X, Qin J	colorectal cancer stem cell ccsc play critical role mediating chemoresistance . lactylation be post translational modification induce lactate regulate gene expression . however whether lactylation affect chemoresistance ccsc remain unknown . here demonstrate that histone lactylation enhance ccsc chemoresistance vitro vivo . furthermore finding show that p300 catalyze lactylation histone h4 k12 whereas hdac1 facilitate delactylation ccsc . notably lactylation h4k12 h4k12la upregulate gclc expression inhibit ferroptosis ccsc inhibition p300 ldha decrease h4k12la level thereby increase chemosensitivity ccsc . additionally gclc inhibitor bso promote ferroptosis sensitize ccsc oxaliplatin . take together finding suggest that histone lactylation upregulate gclc to inhibit ferroptosis signal thus enhance ccsc chemoresistance . finding provide new insight relationship cellular metabolism chemoresistance suggest potential therapeutic strategy target p300 ldha gclc . show that histone h4k12 lactylation promote chemoresistance cscs . p300 catalyze lactylation histone h4 k12 hdac1 inhibit histone lactylation same site . h4k12la cscs regulate expression ferroptosis relate gene gclc thereby inhibit ferroptosis lead chemoresistance . target p300 ldha gclc may be overcome tumor chemoresistance .	Cell death &amp; disease	20/03/2025
10.1016/j.ccell.2025.02.024	pai-1 drive sfrp2(high cancer associate fibroblast hijack abscopal effect	Zhang YP, Guo ZQ, Cai XT, Rong ZX, Fang Y, Chen JQ, Zhuang KM, Ruan MJ, Ma SC, Lin LY, Han DD, Li YS, Wang YY, Wang J, Cao CH, Tang XR, Xie QK, Chen Y, Lin Y, Tan JL, Yu ZH, Wu ZN, Wei W, Zheng DY, Zeng YJ, Ruan YC, Xu ZP, Gu JZ, Xiao LS, Liu L, Guan J, Bai X, Wu DH, Dong ZY	abscopal effect radioimmunotherapy wherein tumor shrinkage occur irradiated field be therapeutically promising clinically rare . mechanism underlie effect remain elusive . here   vivo genome wide crispr screen identify sfrp2 potential stromal regulator abscopal effect . sfrp2 exhibit cancer associate fibroblast caf)-specific expression radioimmunotherapy mediate upregulation unirradiated tumor . conditional sfrp2 knockout cafs boost abscopal effect rewire vascular immune microenvironment to promote cd8(+ t   cell recruitment unirradiated tumor .   vivo lineage tracing reveal that elevate sfrp2 correlate radioimmunotherapy drive pericyte lineage commitment . serum proteomic reveal that irradiate tumor secrete pai-1 trigger distant tumor pericyte cell fate transition sfrp2(high caf lrp1 p65 axis . pharmacologically block sfrp2 pai-1 enhance abscopal effect humanize patient derive xenograft model . finding collectively illustrate that pai-1 induce sfrp2(high caf serve critical stromal regulator to hijack abscopal effect provide promise target enhance radioimmunotherapy effectiveness .	Cancer cell	12/03/2025
10.1016/j.jprot.2021.104190	chronic restraint stress induce change colonic homeostasis relate index	Li CC, Gan L, Tan Y, Yan MZ, Liu XM, Chang Q, Pan RL	chronic stressor represent risk factor etiology exacerbation several gastrointestinal disease . goal present study be to examine whether chronic restraint stress crs could initiate aggravate colonic inflammation integrity damage metabolic disturbance rat . firstly increase inflammatory cytokine interferon γ ifn γ tumor necrosis factor α(tnf α interleukin-10(il-10 decrease tight junction tj protein occludin zonula occludins-1 zo-1 rat colon be observe . secondly untargete metabolomic base ultra performance liquid chromatography couple quadrupole time flight mass uplc q tof ms reveal that trp metabolism be most prominently affect . thirdly quantification trp metabolite prominence ultrafast liquid chromatography couple qtrap 5500 mass uflc qtrap-5500 ms show that trp kynurenine kyn kynurenic acid ka 3 hydroxykynurenine 3 hk be significantly increase . same time 5 hydroxytryptamine 5 ht be unchanged 5 hydroxyindolacetic acid 5 hiaa be significantly decrease colon crs rat . besides trp metabolic enzyme change be same trend correspond metabolite . thus datum show that crs could initiate colonic inflammation integrity damage colonic metabolism disturbance especially trp kyn metabolism pathway rat may provide experimental background future research stress relate gastrointestinal dysfunction . significance chronic exposure psychological stress could induce metabolic imbalance body stressful life event be intimately correlate frequent relapse patient intestinal disorder . present study show that chronic restraint stress crs could initiate aggravate colonic inflammation integrity damage metabolic disturbance especially tryptophan kynurenine metabolism rat . tryptophan kynurenine pathway may be involve initiation development disease induce chronic stress . research may shed light future research stress relate gastrointestinal dysfunction .	Journal of proteomics	30/05/2021
10.1136/gutjnl-2024-334516	dietary whey protein protect crohn&#x27;s disease orchestrate	Su R, Wen W, Jin Y, Cao Z, Feng Z, Chen J, Lu Y, Zhou G, Dong C, Gao S, Li X, Zhang H, Chao K, Lan P, Wu X, Philips A, Li K, Gao X, Zhang F, Zuo T	background gut microbiome diet be important factor pathogenesis management crohn&#x27;s disease cd . however role gut phageome dietary influence be unknown . objective aim to explore effect diet gut phageome bacteriome interaction link cd protection . design recruit cd patient healthy subject n=140 conduct multiomics investigation include pair ileal mucosa phageome bacteriome profiling dietary survey phenome interrogation . screen effect diet gut phageome bacteriome as well epidemiological association cd risk . underlie mechanism be explore target phage bacteria monoculture coculture vitro two mouse model vivo . result dietary screening human whey protein wp consumption be find to profoundly impact gut phageome bacteriome more pronounced phageome be associate low cd risk . indeed wp reshape gut phageome can causally attenuate intestinal inflammation as show faecal phageome versus bacteriome transplantation wp consume versus wp non consuming mouse recipient mouse . mechanistically wp induce phage newly isolate phage akkzt003p herein lysis mucin forage bacterium akkermansia muciniphila unleash symbiotic bacterium streptococcus thermophilus to counteract intestinal inflammation . conclusion study chart importance cross kingdom interaction gut phage bacteria mediate dietary effect cd protection . importantly uncover beneficial dietary wp keystone phage akkzt003p probiotic s. thermophilus can be use cd management future .	Gut	23/03/2025
10.1056/NEJMoa2414482	tezepelumab adults severe chronic rhinosinusitis nasal polyps .	Lipworth BJ, Han JK, Desrosiers M, Hopkins C, Lee SE, Mullol J, Pfaar O, Li T, Chen C, Almqvist G, Margolis MK, McLaren J, Jagadeesh S, MacKay J, Megally A, Hellqvist Å, Mankad VS, Bahadori L, Ponnarambil SS	background treatment tezepelumab have be effective sinonasal symptom patient severe uncontrolled asthma history chronic rhinosinusitis nasal polyp efficacy safety adult severe uncontrolled chronic rhinosinusitis nasal polyp be unknown . method randomly assign adult physician diagnose symptomatic severe chronic rhinosinusitis nasal polyp to receive standard care tezepelumab dose 210 mg placebo subcutaneously 4 week 52 week . coprimary end point be change baseline total nasal polyp score range 0 to 4 nostril high score indicate great severity mean nasal congestion score range 0 to 3 high score indicate great severity week 52 . key secondary end point assess overall population be loss smell score total score sinonasal outcome test snot-22 range 0 to 110 high score indicate great severity lund mackay score range 0 to 24 high score indicate great severity total symptom score range 0 to 24 high score indicate great severity first decision to treat nasal polyp surgery use systemic glucocorticoid therapy assess time event analysis individual composite . result total 203 patient be assign to receive tezepelumab 205 to receive placebo . week 52 patient receive tezepelumab have significant improvement total nasal polyp score mean difference vs. placebo -2.07 95 confidence interval ci -2.39 to -1.74 mean nasal congestion score -1.03 95 ci -1.20 -0.86 p&lt;0.001 score . tezepelumab significantly improve loss smell score mean difference vs. placebo -1.00 95 ci -1.18 -0.83 snot-22 total score -27.26 95 ci -32.32 -22.21 lund mackay score -5.72 95 ci -6.39 -5.06 total symptom score -6.89 95 ci -8.02 -5.76 p&lt;0.001   score . surgery nasal polyp be indicate significantly few patient tezepelumab group 0.5 placebo group 22.1 hazard ratio 0.02 95 ci 0.00 to 0.09 be significantly less use systemic glucocorticoid tezepelumab 5.2 placebo 18.3 hazard ratio 0.12 95 ci 0.04 0.27 p&lt;0.001 time event analysis . conclusion tezepelumab therapy lead significantly great reduction size nasal polyp severity nasal congestion sinonasal symptom use nasal polyp surgery systemic glucocorticoid placebo adult severe uncontrolled chronic rhinosinusitis nasal polyp . fund astrazeneca amgen waypoint clinicaltrials.gov number nct04851964 . .	The New England journal of medicine	01/03/2025
10.1158/0008-5472.CAN-24-3180	slc3a2 mediated lysine uptake cancer cells restricts t cell activity	Chang Y, Wang N, Li S, Zhang J, Rao Y, Xu Z, Li L, Wu H, Chen J, Lin Y, Huang X, Liu P, Zhang J, Liao Y, Lin C, Huang C, Xia N	abnormal amino acid metabolism support cancer cell proliferation invasion immune evasion hepatocellular carcinoma hcc . previous research explore amino acid metabolism hcc have primarily focus how metabolic reprogramme impact tumor cell . here focus role amino acid metabolism dysregulation crosstalk hcc t cell . hcc cell disrupt lysine uptake t cell lead impaired t cell immunity . lysine deprivation decrease stat3 level t cell inhibit t cell proliferation effector function ultimately promote tumor progression . mechanistically hcc cell outcompete t cell lysine express high level lysine transporter slc3a2 . clinically elevated slc3a2 expression correlate poor survival be link dysregulate t cell functional gene signature hcc patient . furthermore multikinase inhibitor lenvatinib induce c myc slc3a2 regulatory axis limit efficacy lenvatinib treatment . lysine supplementation enhance tumor sensitivity combined treatment lenvatinib anti pd-1 immunotherapy . finding suggest that lysine supplementation be potential therapeutic strategy treat hcc enhance sensitivity hcc tyrosine kinase inhibitor immune checkpoint blockade .	Cancer research	24/03/2025
10.1186/s12933-025-02625-8	piezo1 deletion mitigate diabetic cardiomyopathy maintain mitochondrial	Niu W, Liu X, Deng B, Hong T, Wang C, Yan Y, Liu J, Jiang Y, Li J	objective increase evidence highlight critical role piezo1 cardiovascular disease expression upregulate diabetic heart . however involvement piezo1 pathogenesis diabetic cardiomyopathy dcm remain unclear . study aim to elucidate regulatory role piezo1 mitochondrial dynamic context dcm to investigate underlie mechanism . method construct cardiac specific knockout piezo1 piezo1(∆myh6 mouse . type 1 diabetes be induce use streptozotocin stz injection while type 2 diabete be establish high fat diet combine stz . echocardiography assess left ventricular function histological evaluation use masson stain to examine cardiac pathology piezo1(fl fl control piezo1(∆myh6 control piezo1(fl fl diabetic piezo1(∆myh6 diabetic mouse . mitochondrial function include oxygen specie level mitochondrial morphology respiration rate be also assess . result finding reveal that piezo1 expression be upregulate myocardium diabetic mouse high glucose treat cell . cardiac specific knockout piezo1 improve cardiac dysfunction ameliorate cardiac fibrosis diabetic mouse . moreover piezo1 deficiency also attenuate mitochondrial impairment . piezo1(fl fl diabetic mouse exhibit increase calpain activity excessive mitochondrial fission mediate drp1 obvious reduced fusion however piezo1 deficiency restore calpain level mitochondrial dysfunction . observation be also corroborate h9c2 cell neonatal mouse cardiomyocyte . cardiac specific knockout piezo1 increase phosphorylation drp1 erk1/2 vivo vitro . piezo1 knockout treatment inhibitor improve mitochondrial function . conclusion study provide first evidence that piezo1 be elevate dcm modulation mitochondrial dynamic be reverse piezo1 deficiency . thus piezo1 inhibition may provide promising therapeutic strategy treatment dcm .	Cardiovascular diabetology	20/03/2025
10.1053/j.gastro.2025.02.036	perforin generate cd8(+ t cells exacerbates ibd induced depression	Huang S, Pan L, Pang S, Guo H, Li M, Tian Y, Shi W, Liu B, Wang S, Fan Z, Zong Y, Tian D, Zhang D	background amp aims approximately 25.2 inflammatory bowel disease ibd patient suffer psychological disorder particularly depression . recent study have indicate close relationship intestinal immunity brain disorder . method perform transcriptome analysis immunofluorescence stain colonic sample ibd patient . role perforin generate colonic cd8(+ t cell ibd induce depression be investigate dss- cd8(+ t cell transfer induce colitis use prf1 egfp reporter prf1 knockout mouse . result study reveal significant correlation depressive symptom severity perforin production cd8(+ t cell ibd patient mouse colitis . moreover perforin deficiency cd8(+ t cell mitigate inflammation depressive like behavior mouse colitis . mechanistically perforin granzyme b be find to stimulate expression cxcl9 colonic epithelial cell . cxcl9 be show to be release circulation to enter hippocampus where induce endoplasmic reticulum er stress hippocampal neuron cxcr3 hspa5 axis . cascade event subsequently be find to exacerbate depression . neutralize cxcl9 vivo alleviate depression have effect colitis mouse . conclusion perforin generate colonic cd8(+ t cell promote intestinal epithelial cell cxcl9 production lead neuronal er stress hippocampus induce depression ibd .	Gastroenterology	20/03/2025
10.1038/s41596-025-01145-9	spatially resolve genome wide joint profiling epigenome transcriptome	Li H, Bao S, Farzad N, Qin X, Fung AA, Zhang D, Bai Z, Tao B, Fan R	epigenome cell be tightly correlate gene transcription control cell identity diverse biological activity . recent advance spatial technology have improve understanding tissue heterogeneity analyze transcriptomic epigenomic spatial information preserve have be mainly restrict one molecular layer time . here present procedure two spatially resolve sequence method spatial atac rna seq spatial cut&amp;tag rna seq that co profile transcriptome epigenome genome wide . method transcriptomic readout be generate tissue fixation permeabilization situ reverse transcription . spatial atac rna seq tn5 transposase be use to probe accessible chromatin spatial cut&amp;tag rna seq tissue be incubate primary antibody target histone modification follow protein a fuse tn5 induce tagmentation . method leverage microfluidic device deliver two set oligonucleotide barcode to generate two dimensional mosaic tissue pixel near single cell resolution . spatial atac rna seq spatial cut&amp;tag rna seq library can be generate 3 5 d allow researcher to simultaneously investigate transcriptomic landscape epigenomic landscape intact tissue section . protocol be extension previous spatially resolve epigenome sequence protocol provide opportunity multimodal profiling .	Nature protocols	21/03/2025
10.1126/science.adt7570	hippocampal encoding memory human infant .	Yates TS, Fel J, Choi D, Trach JE, Behm L, Ellis CT, Turk-Browne NB	human lack memory specific event first few year life . investigate mechanistic basis infantile amnesia scan brain awake infant functional magnetic resonance imaging while perform subsequent memory task . great activity hippocampus viewing previously unseen photograph be relate late memory base look behavior begin 1 year age suggest that capacity to encode individual memory come online infancy . availability encode mechanism episodic memory period human life be later lose autobiographical record imply that postencode mechanism whereby memory infancy become inaccessible retrieval may be more responsible infantile amnesia .	Science (New York, N.Y.)	21/03/2025
