DOI	Title	Authors	Abstract	Journal	Date
10.1002/rcm.8668	quantification glyphosate aminomethylphosphonic acid microbiome	Fritz-Wallace K, Engelmann B, Krause JL, Schäpe SS, Pöppe J, Herberth G, Rösler U, Jehmlich N, von Bergen M, Rolle-Kampczyk U	rationale glyphosate be one most widely use herbicide be suspect to affect intestinal microbiota inhibition aromatic amino acid synthesis shikimate pathway . vitro microbiome bioreactor be increasingly use model system to investigate effect intestinal microbiota consequently method quantitation glyphosate degradation product aminomethylphosphonic acid ampa microbiome model system be require . methods optimize protocol enable analysis glyphosate ampa simple extraction methanol acetonitrile water 2:3:1 further enrichment step . glyphosate ampa be separate liquid chromatography amide column identify quantify target tandem mass spectrometry method use qtrap 5500 system ab sciex . result method have limit detection lod extract water sample lt;2   ng ml glyphosate ampa . complex intestinal medium lod be 2 5   ng ml glyphosate ampa respectively . lod allow measurement exposure relevant concentration . glyphosate level bioreactor model porcine colon be determine consequently be verify whether ampa be produce porcine gut microbiota . conclusion method present here allow quantitation glyphosate ampa complex bioreactor fluid thus enable study impact glyphosate metabolism intestinal microbiota . addition extraction protocol be compatible untargeted metabolomic analysis thus allow to look other perturbation cause glyphosate same sample .	Rapid communications in mass spectrometry : RCM	15/04/2020
10.1016/S0140-6736(25)00109-6	calcitonin gene relate peptide target therapy migraine current role	Versijpt J, Paemeleire K, Reuter U, MaassenVanDenBrink A	almost 40 year ago discovery vasoactive neuropeptide calcitonin gene relate peptide cgrp role migraine pathophysiology usher new era migraine treatment . since 2018 monoclonal antibody mabs target cgrp pathway be available migraine prevention . approval drug mark pioneer development as be first pharmacological agent specifically tailor migraine prevention . introduction agent contrast historical reliance traditional preventive medication initially formulate other indication later repurpose migraine therapy . although emergence evidence efficacy safety cgrp target mabs have raise bar treatment success migraine efficacy other headache entity such cluster headache be low to moderate . small molecule cgrp receptor antagonist call gepant have also be prove to be effective acute preventive migraine treatment . furthermore agent have bridge traditional category acute preventive treatment strategy . short term prevention treatment prodromal phase migraine represent emerge strategy enable clinician to develop treatment approach design to meet change patient need however strategy still require more formal evidence . although solid datum have be gather further research concern efficacy long term safety drug target cgrp pathway robust pharmacoeconomic evaluation be need . finally randomise withdrawal switch study would facilitate formulation evidence base guidance discontinuation switch drug target cgrp pathway .	Lancet (London, England)	22/03/2025
10.1126/science.ado8316	synaptic architecture memory engram mouse hippocampus .	Uytiepo M, Zhu Y, Bushong E, Chou K, Polli FS, Zhao E, Kim KY, Luu D, Chang L, Yang D, Ma TC, Kim M, Zhang Y, Walton G, Quach T, Haberl M, Patapoutian L, Shahbazi A, Zhang Y, Beutter E, Zhang W, Dong B, Khoury A, Gu A, McCue E, Stowers L, Ellisman M, Maximov A	memory engram be form experience dependent plasticity neural circuit detailed architecture remain unresolved . use three dimensional electron microscopy perform nanoscale reconstruction hippocampal ca3 ca1 pathway chemogenetic labeling cellular ensemble recruit associative learning . neuron remote history activity coincide memory acquisition show strong preference wiring other . instead connectome expand multisynaptic bouton independently coactivation state postsynaptic partner . rewiring ensemble represent initial engram be accompany input specific spatially restrict upscaling individual synapsis as well remodeling mitochondria smooth endoplasmic reticulum interaction astrocyte . finding elucidate physical hallmark long term memory offer structural basis cellular flexibility information coding .	Science (New York, N.Y.)	21/03/2025
10.1016/j.immuni.2025.02.023	particle uptake macrophage trigger bifurcated transcriptional pathway that	Cobo I, Murillo J, Alishala M, Calderon S, Coras R, Hemming B, Inkum F, Rosas F, Takei R, Spann N, Prohaska TA, Alabarse PVG, Jeong SJ, Nickl CK, Cheng A, Li B, Vogel A, Weichhart T, Fuster JJ, Le T, Bradstreet TR, Webber AM, Edelson BT, Razani B, Ebert BL, Taneja R, Terkeltaub R, Bryan RL, Guma M, Glass CK	exposure particle be driver several inflammatory disease . here investigate macrophage response monosodium urate crystal calcium pyrophosphate crystal aluminum salt silica nanoparticle . while particle induce distinct gene expression pattern identify common inflammatory signature acute activation lysosomal acidification gene . use monosodium urate crystal model demonstrate that lysosomal gene program be regulate 5&#x27;-prime amp activate protein kinase ampk)-dependent transcriptional network include tfeb tfe3 epigenetic regulator dna methyl transferase 3a dnmt3a dot1l. lysosomal acidification program operate parallel largely independently jnk ap-1 dependent network drive crystal induce chemokine cytokine expression . finding reveal bifurcation pathway govern inflammatory lysosomal response offer insight treat particle associate disease .	Immunity	19/03/2025
10.1161/JAHA.124.039751	impact dna methylation age acceleration long term mortality us adult	Wu S, Zhu J, Lyu S, Wang J, Shao X, Zhang H, Zhong Z, Liu H, Zheng L, Chen Y	background association dna methylation age acceleration dnamaa cardiovascular kidney metabolic ckm syndrome stage long term mortality population ckm syndrome remain unclear . methods result cohort study include 1889 participant national health nutrition examination survey 1999 2002 ckm stage dna methylation age datum . dnamaa be calculate residual regression dna methylation age chronological age . primary outcome be all cause mortality cardiovascular noncardiovascular mortality secondary outcome . proportional odd model assess association dnamaas ckm stage cox proportional hazard regression model estimate association dnamaas mortality . significant association be find dnamaas advanced ckm stage particularly grimage2mort acceleration grimaa odd ratio or 1.547 95 ci 1.316 1.819 . average follow up 14   year 1015 death occur . 5 unit increase grimaa be associate 50 increase cause mortality 95 ci 1.39 1.63 77 increase cardiovascular mortality 95 ci 1.46 2.15 42 increase noncardiovascular mortality 95 ci 1.27 1.59 . low grimaa tertile reference high grimaa tertile show hazard ratio 1.95 95 ci 1.56 2.45 cause mortality 3.06 95 ci 2.13 4.40 cardiovascular mortality 1.65 95 ci 1.20 2.29 noncardiovascular mortality . mediation analysis indicate that grimaa mediate association various exposure include physical activity healthy eating index-2015 score hemoglobin a1c etc . mortality . conclusion grimaa may serve valuable biomarker assess ckm stage mortality risk individual ckm syndrome thereby inform personalize management strategy .	Journal of the American Heart Association	21/03/2025
10.1016/j.xcrm.2025.102031	cerebrospinal fluid proteomic identification biomarker amyloid tau	Wang Z, Chen Y, Gong K, Zhao B, Ning Y, Chen M, Li Y, Ali M, Timsina J, Liu M, Cruchaga C, Jia J	accurate staging alzheimer&#x27;s disease ad pathology be crucial therapeutic trial prognosis exist fluid biomarker lack specificity especially assess tau deposition severity amyloid beta aβ)-positive patient . analyze cerebrospinal fluid csf sample 136 participant alzheimer&#x27;s disease neuroimaging initiative use more 6,000 protein . apply machine learning to predict ad pathological stage define amyloid tau positron emission tomography pet . identify two distinct protein panel 16 protein include neurofilament heavy chain nefh sparc relate modular calcium bind protein 1 smoc1 distinguish aβ negative tau negative a t- a+ individual nine protein such hcls1 associate protein x-1 hax1 glucose-6 phosphate isomerase gpi differentiate a+t+ a+t- stage . signature outperform established csf biomarker area curve auc 0.92 versus 0.67 0.70 accurately predict disease progression decade . finding be validate internal external cohort . result underscore potential proteomic base signature to refine ad diagnostic criterion improve patient stratification clinical trial .	Cell reports. Medicine	12/03/2025
10.1001/jamanetworkopen.2025.1320	discontinuation oral anticoagulation successful atrial fibrillation	Iwawaki T, Yanagisawa S, Inden Y, Hiramatsu K, Yamauchi R, Miyamae K, Miyazawa H, Goto T, Kondo S, Tachi M, Shimojo M, Tsuji Y, Murohara T	importance be clear consensus regard discontinuation oral anticoagulant oacs catheter ablation ca atrial fibrillation af . objective to evaluate thromboembolic major bleed event cause death follow oac discontinuation characteristic associate patient prognosis successful ca . design setting participant retrospective cohort study include patient af recurrence adverse event 12 month ca undergo first ca january 1 2006 december 31 2021 . study population be divide group accord continuation discontinuation oacs landmark period 12 month ca . follow datum be acquire december 31 2023 study analysis be conduct january april 2024 . exposures oac discontinuation . main outcomes measures primary outcome be thromboembolic major bleed event cause death 12 month . inverse probability treatment weighting iptw propensity score match analysis be use to adjust baseline characteristic . result study include 1821 patient mean sd age 63.6 11.7 year 1339 man 73.5 . overall 922 patient 50.6 continue oac 12 month whereas 899 49.4 discontinue oac . mean sd follow up 4.8 4.0 year thromboembolic event major bleed event death occur 43 2.4 41 2.3 71 3.9 patient respectively . iptw adjustment oac discontinuation group demonstrate significantly high incidence thromboembolism incidence rate 0.86 95 ci 0.45 1.35 vs 0.37 95 ci 0.22 0.54 100 person year log rank p   =   .04 low incidence major bleeding incidence rate 0.10 95 ci 0.02 0.19 vs 0.65 95 ci 0.43 0.90 100 person year log rank p   lt   .001 continuation group . subgroup analysis oac discontinuation be associate high risk thromboembolism patient asymptomatic af leave ventricular ejection fraction less 60 leave atrial diameter 45 mm great . contrast oac discontinuation be beneficial reduce major bleed risk patient has bled score 2 great . outcome be similar propensity score match analysis use 1100 pair match patient except insignificant difference thromboembolic event . difference mortality 2 group be not statistically significant . conclusion relevance retrospective cohort study discontinuation oacs after successful ca be associate increase thromboembolic event decrease bleed event . benefit discontinue oac be stratify accord specific characteristic pende future prospective randomized study .	JAMA network open	03/03/2025
10.1016/j.xgen.2025.100810	cross ancestry analysis chinese european population reveal insight	Lin C, Xia M, Dai Y, Huang Q, Sun Z, Zhang G, Luo R, Peng Q, Li J, Wang X, Lin H, Gao X, Tang H, Shen X, Wang S, Jin L, Hao X, Zheng Y	differential susceptibility various disease correspond metabolite variation have be document diverse ethnic population genetic determinant disparity remain unclear . here perform large scale genome wide association study 171 directly quantifiable metabolite nuclear magnetic resonance base metabolomic platform 10,792 han chinese individual . identify 15 variant metabolite association eight be successfully replicate independent chinese population n   = 4,480 . cross ancestry meta analysis integrate 213,397 european individual uk biobank identify 228 additional variant metabolite association improve fine mapping precision . moreover two sample mendelian randomization analysis reveal evidence that genetically predict level triglyceride high density lipoprotein be associate high risk coronary artery disease glycine low risk heart failure ancestry . finding enhance understanding shared specific genetic architecture metabolite as well role complex disease population .	Cell genomics	19/03/2025
10.1016/j.cell.2025.02.027	microtubule asgard archaea .	Wollweber F, Xu J, Ponce-Toledo RI, Marxer F, Rodrigues-Oliveira T, Pössnecker A, Luo ZH, Malit JJL, Kokhanovska A, Wieczorek M, Schleper C, Pilhofer M	microtubule be hallmark eukaryote . archaeal bacterial homolog tubulin typically form homopolymer non tubular superstructure . origin heterodimeric tubulin assemble microtubule remain unclear . here report discovery microtubule form tubulin asgard archaea close know relative eukaryote . asgard tubulin atuba b be closely relate eukaryotic α β tubulin enigmatic bacterial tubulin btuba b. proteomics candidatus lokiarchaeum ossiferum show that atuba b be highly express . cryoelectron microscopy structure demonstrate that atuba b form eukaryote like heterodimer assemble 5 protofilament bona fide microtubule   vitro . additional paralog atubb2 lack nucleotide bind site competitively displace atubb. atuba b2 heterodimer polymerize 7 protofilament non canonical microtubule . sub population ca . lokiarchaeum ossiferum cell cryo tomography reveal tubular structure while expansion microscopy identify atuba b cytoskeletal assembly . finding suggest pre eukaryotic origin microtubule provide framework understand fundamental principle microtubule assembly .	Cell	19/03/2025
10.1038/s41467-025-58186-7	serum vegf a biomarker addition bevacizumab to	Tanaka K, Sugisaka J, Shiraishi Y, Watanabe Y, Daga H, Azuma K, Nishino K, Mori M, Ota T, Saito H, Hata A, Sakaguchi T, Kozuki T, Akamatsu H, Matsumoto H, Tachihara M, Wakuda K, Sato Y, Ozaki T, Tsuchiya-Kawano Y, Yamamoto N, Nakagawa K, Okamoto I	anti vascular endothelial growth factor vegf agent combination immunotherapy have improve outcome cancer patient predictive biomarker have not be elucidate . report here preplanne analysis previously report apple study phase 3 trial evaluate efficacy bevacizumab combination atezolizumab plus platinum chemotherapy metastatic nonsquamous non small cell lung cancer nsclc . investigate correlation serum vegf a isoform baseline treatment response use enzyme link immunosorbent assay . reveal that addition bevacizumab significantly improve progression free survival patient low vegf a level . result demonstrate that measure serum vegf a isoform may identify nsclc patient be likely to benefit addition bevacizumab to immunotherapy . assay be easy to measure have significant potential further clinical development .	Nature communications	22/03/2025
10.1038/s43018-025-00937-y	palmitoylation gpx4 targetable zdhhc8 determine ferroptosis	Zhou L, Lian G, Zhou T, Cai Z, Yang S, Li W, Cheng L, Ye Y, He M, Lu J, Deng Q, Huang B, Zhou X, Lu D, Zhi F, Cui J	ferroptosis be closely link various pathophysiological process include aging neurodegeneration ischemia reperfusion injury viral infection notably cancer progression however post translational regulatory mechanism remain incompletely understood . here reveal crucial role s palmitoylation regulate ferroptosis glutathione peroxidase 4 gpx4 pivotal enzyme that mitigate lipid peroxidation . identify zinc finger dhhc domain contain protein 8 zdhhc8 s acyltransferase be highly express multiple tumor palmitoylate gpx4 cys75 . small molecule drug screening identify pf-670462 zdhhc8 specific inhibitor promote degradation zdhhc8 consequently attenuate gpx4 palmitoylation enhance ferroptosis sensitivity . pf-670462 inhibition zdhhc8 facilitate cd8(+ cytotoxic t cell induce ferroptosis tumor cell thereby improve efficacy cancer immunotherapy b16 f10 xenograft model . finding reveal prominent role zdhhc8 gpx4 axis regulate ferroptosis highlight potential application zdhhc8 inhibitor anticancer therapy .	Nature cancer	19/03/2025
10.1055/s-2007-971124	physiological effect variation spontaneously choose crank rate	Marais G, Weissland T, Robin H, Vanvelcenaher JM, Lavoie JM, Pelayo P	aim present study be to compare physiological response when crank rate be choose spontaneously ts set + 10 t-10 t+10 freely choose rate two upper body exercise i sub maximal test t(sub intensity range 50 to 80 118.4 + 10.2 to 189.5 + 16.3 watt maximal power mp ii supramaximal test t(supra power output be set 110 120 260.5 + 22.4 284.2 + 24.4 watt mp . eight nationally internationally rank kayaker age 20 + 2 year perform test power output be normalise relation maximal power output determine t(mp . t(sub+10 oxygen uptake ventilation be significantly p&lt 0.05 high t(subxs . t(sub+10 t(sub-10 energy expenditure be significantly p&lt;0.05 high gross net efficiency low t(subxs . t(supra-10 when power output be set 110 mp time exhaustion be significantly high p&lt;0.05 t(supraxs . finding present study suggest that upper body exercise perform ergocycle should be conduct use freely spontaneously choose crank rate .	International journal of sports medicine	01/05/1999
10.1186/s13073-025-01456-2	rare damaging ccr2 variant be associate low lifetime cardiovascular	Georgakis MK, Malik R, Bounkari OE, Hasbani NR, Li J, Huffman JE, Shakt G, Tack RWP, Kimball TN, Asare Y, Morrison AC, Tsao NL, Judy R, Mitchell BD, Xu H, Montasser ME, Do R, Kenny EE, Loos RJF, Terry JG, Carr JJ, Bis JC, Psaty BM, Longstreth WT, Young KA, Lutz SM, Cho MH, Broome J, Khan AT, Wang FF, Heard-Costa N, Seshadri S, Vasan RS, Palmer ND, Freedman BI, Bowden DW, Yanek LR, Kral BG, Becker LC, Peyser PA, Bielak LF, Ammous F, Carson AP, Hall ME, Raffield LM, Rich SS, Post WS, Tracy RP, Taylor KD, Guo X, Mahaney MC, Curran JE, Blangero J, Clarke SL, Haessler JW, Hu Y, Assimes TL, Kooperberg C, Bernhagen J, Anderson CD, Damrauer SM, Zand R, Rotter JI, de Vries PS, Dichgans M	background previous work have show role ccl2 key chemokine govern monocyte trafficking atherosclerosis . however remain unknown whether target ccr2 cognate receptor ccl2 provide protection human atherosclerotic cardiovascular disease . methods computationally predict damaging loss function revel   gt   0.5 variant ccr2 be detect whole exome sequence datum 454,775 uk biobank participant test association cardiovascular endpoint gene burden test . give key role ccr2 monocyte mobilization variant associate low monocyte count be prioritize experimental validation . response ccl2 human cell transfecte variant be test migration camp assay . validate damaging variant be test association cardiovascular endpoint atherosclerosis burden vascular risk factor . significant association be replicate six independent dataset n   =   1,062,595 . result carrier 45 predict damaging loss function ccr2 variant n   =   787 individual be low risk myocardial infarction coronary artery disease . one variant m249 k n   =   585 0.15 european ancestry individual be associate low monocyte count decrease downstream signaling chemoattraction response ccl2 . while m249 k show association conventional vascular risk factor be consistently associate low risk myocardial infarction odd ratio or 0.66 95 confidence interval ci 0.54 0.81 p   =   6.1   ×   10(-5 coronary artery disease 0.74 95%ci 0.63 0.87 p   =   2.9   ×   10(-4 uk biobank six replication cohort . phenome wide association study be evidence high risk infection m249 k carrier . conclusion carrier experimentally confirm damage ccr2 variant be low lifetime risk myocardial infarction coronary artery disease carry high risk infection . finding provide genetic support translational potential ccr2 targeting atheroprotective approach .	Genome medicine	21/03/2025
10.1186/s12889-025-22231-3	explore nonlinear association cardiometabolic index	Zhou H, Mao Y, Ye M, Zuo Z	background hypertension be prevalent chronic disease affect 1.2 billion people worldwide represent major modifiable risk factor cardiovascular disease . waist height ratio whtr triglyceride high density lipoprotein cholesterol tg hdl c ratio be establish metabolic indicator link risk cardiovascular metabolic disease . recently cardiometabolic index cmi combine whtr tg hdl c ratio have be propose to provide comprehensive assessment metabolic health . study investigate association cmi hypertension use datum national health nutrition examination survey nhanes . methods study utilize nhanes datum nine cycle span 2001 2018 encompass 20,049 participant age 20 . exclusion be make individual incomplete cmi hypertension datum pregnant woman . cmi be calculate multiply whtr tg hdl c ratio . hypertension be define accord american heart association guideline . relationship cmi hypertension be evaluate use multivariate logistic regression analysis additional subgroup analysis conduct base demographic factor . nonlinear relationship be analyze use smoothing curve fitting technique . result study identify significant positive correlation cmi hypertension risk increase one unit cmi associate 9 heighten risk hypertension 1.09 95 ci 1.05 1.13 . association remain significant various demographic subgroup . nonlinear relationship be observe critical cmi threshold 2.64 . threshold high cmi value be associate progressively high prevalence hypertension whereas threshold further increase cmi do not significantly correlate elevated risk hypertension . conclusion study demonstrate that cmi be significantly associate hypertension risk may serve valuable tool early screening risk assessment particularly identify individual high risk reach critical cmi threshold . result underscore importance address metabolic health prevention management hypertension . future research should focus longitudinal study to establish causality explore clinical utility cmi hypertension screening examine applicability diverse population .	BMC public health	21/03/2025
10.1016/j.stem.2025.02.013	human skeletal development regeneration be shape functional diversity	Ambrosi TH, Taheri S, Chen K, Sinha R, Wang Y, Hunt EJ, Goodnough LH, Murphy MP, Steininger HM, Hoover MY, Felix F, Weldon KC, Koepke LS, Sokol J, Liu DD, Zhao L, Conley SD, Lu WJ, Morri M, Neff NF, Van Rysselberghe NL, Wheeler EE, Wang Y, Leach JK, Saiz A, Wang A, Yang GP, Goodman S, Bishop JA, Gardner MJ, Wan DC, Weissman IL, Longaker MT, Sahoo D, Chan CKF	skeleton be one most structurally compositionally diverse organ system human body depend unique cellular dynamism . here integrate prospective isolation human skeletal stem cell hsscs cd45(-)cd235a(-)tie2(-)cd31(-)cd146(-)pdpn(+)cd73(+)cd164(+ ten skeletal site functional assay single cell rna sequence scrna seq analysis to identify chondrogenic osteogenic stromal fibrogenic subtype hsscs development linkage skeletal phenotype . map distinct composition hssc subtype multiple skeletal site demonstrate unique   vivo clonal dynamic . find that age relate change bone formation regeneration disorder stem pathological fibroblastic shift hssc pool . utilize boolean algorithm uncover gene regulatory network dictate difference ability hsscs to generate specific skeletal tissue . importantly hssc lineage dynamic be pharmacologically malleable provide new strategy to treat aberrant hssc diversity central age skeletal malady .	Cell stem cell	19/03/2025
10.1016/S1474-4422(25)00033-X	advance diagnosis classification management pain parkinson&#x27;s	Tinazzi M, Gandolfi M, Artusi CA, Bannister K, Rukavina K, Brefel-Courbon C, de Andrade DC, Perez-Lloret S, Mylius V	10 million people affect worldwide parkinson&#x27;s disease be fast grow neurological disorder . more two third people parkinson&#x27;s disease live chronic pain can manifest various stage disease substantially affect daily activity quality life . parkinson&#x27;s disease pain classification system overcome limitation previous classification system distinguish pain relate parkinson&#x27;s disease unrelated pain while also incorporate clinical pathophysiological mechanistic descriptor such nociceptive neuropathic nociplastic pain . system provide framework accurate diagnosis mechanism base therapy . alongside appropriate classification pain consideration treatment approach include non invasive pharmacological non pharmacological invasive strategy tailor specific type pain will refine inform research trial clinical practice when come treat pain parkinson&#x27;s disease .	The Lancet. Neurology	01/04/2025
10.1016/j.cell.2025.02.019	small molecule hypoxia therapy mitochondrial disease .	Falk MJ	issue   cell blume et   al . provide compelling rationale   pursue pharmacologic optimization   small molecule   quot;hypoxystat,&quot   leave shift oxyhemoglobin dissociation curve red blood cell attempt to induce   effective sustained reduction chronic tissue hyperoxia primary mitochondrial disease pmd be well tolerate effective pre symptomatic advanced disease treatment to extend survival improve neurologic outcome mouse model leigh syndrome spectrum .	Cell	20/03/2025
